{
  "componentType" : "org.ikasan.exceptionResolver.ExceptionResolver",
  "paletteDisplayOrder": 20,
  "componentShortType": "Exception Resolver",
  "helpText": "<p>Exception resolvers determine what action to take when an error occurs, such as retrying, excluding the event and continuing, or stopping the flow.</p>"
}