{
  "componentType": "org.ikasan.spec.flow.Flow",
  "paletteDisplayOrder": 2,
  "componentShortType": "Flow",
  "helpText": "<strong>Flow</strong><p>The flow is the container for components and generally represents an atomic action.</p>",
  "allowableProperties": {
    "description": {
      "propertyName": "description",
      "helpText": "A more detailed description of the component that may assist in support."
    }
  }

}